{
  "dag_nodes": [
    { "id": "n1", "label": "HTML 标签与属性语法", "granularity": "操作级", "min_requirement": "能写" },
    { "id": "n2", "label": "文档基本结构 (DOCTYPE/html/head/body)", "granularity": "操作级", "min_requirement": "能写" },
    { "id": "n3", "label": "文本元素 (h1-h6/p/br/hr)", "granularity": "操作级", "min_requirement": "能写" },
    { "id": "n4", "label": "超链接 (a标签、href、target)", "granularity": "操作级", "min_requirement": "能写" },
    { "id": "n5", "label": "图片 (img标签、alt/src、路径)", "granularity": "操作级", "min_requirement": "能写" },
    { "id": "n6", "label": "列表 (ul/ol/li)", "granularity": "操作级", "min_requirement": "能写" },
    { "id": "n7", "label": "表格 (table/tr/td/th)", "granularity": "操作级", "min_requirement": "能写" },
    { "id": "n8", "label": "表单基础 (form/action/method)", "granularity": "操作级", "min_requirement": "能写" },
    { "id": "n9", "label": "表单控件 (input 类型/select/textarea)", "granularity": "操作级", "min_requirement": "能写" },
    { "id": "n10", "label": "表单提交 (button/label/字段分组)", "granularity": "操作级", "min_requirement": "能写" },
    { "id": "n11", "label": "语义化标签 (header/nav/main/section/article/footer)", "granularity": "理解级", "min_requirement": "能写" },
    { "id": "n12", "label": "代码结构与注释 (可读性/缩进/嵌套)", "granularity": "理解级", "min_requirement": "能教" },
    { "id": "n13", "label": "多页面网站的整合 (导航链接多页面)", "granularity": "操作级", "min_requirement": "能写" },
    { "id": "n14", "label": "综合项目:个人作品集网站 — 首页结构与Hero区", "granularity": "操作级", "min_requirement": "能写" },
    { "id": "n15", "label": "综合项目:项目展示页(卡片列表)", "granularity": "操作级", "min_requirement": "能写" },
    { "id": "n16", "label": "综合项目:联系表单页 + 站点整合", "granularity": "操作级", "min_requirement": "能写" },
    { "id": "n17", "label": "部署上线 (GitHub Pages 静态托管)", "granularity": "操作级", "min_requirement": "能写" }
  ],
  "dag_edges": [
    { "from": "n1", "to": "n2", "strength": "strong", "note": "不懂标签语法无法写文档" },
    { "from": "n1", "to": "n3", "strength": "strong", "note": "文本元素也是标签" },
    { "from": "n1", "to": "n4", "strength": "strong", "note": "a标签+href属性" },
    { "from": "n1", "to": "n5", "strength": "strong", "note": "img标签属性" },
    { "from": "n1", "to": "n6", "strength": "strong", "note": "列表标签" },
    { "from": "n1", "to": "n8", "strength": "strong", "note": "form标签基础" },
    { "from": "n3", "to": "n7", "strength": "strong", "note": "td内放文本" },
    { "from": "n3", "to": "n12", "strength": "weak", "note": "文本缩进可读性" },
    { "from": "n4", "to": "n13", "strength": "strong", "note": "多页面靠a标签链接" },
    { "from": "n5", "to": "n15", "strength": "strong", "note": "项目卡片用img" },
    { "from": "n6", "to": "n15", "strength": "strong", "note": "项目列表用ul/li" },
    { "from": "n7", "to": "n15", "strength": "weak", "note": "项目数据可用表格展示(可选)" },
    { "from": "n8", "to": "n9", "strength": "strong", "note": "form 内含 input 控件" },
    { "from": "n9", "to": "n10", "strength": "strong", "note": "控件+提交按钮组成完整表单" },
    { "from": "n10", "to": "n16", "strength": "strong", "note": "联系表单页的核心" },
    { "from": "n11", "to": "n14", "strength": "strong", "note": "首页用语义化标签布局" },
    { "from": "n11", "to": "n15", "strength": "strong", "note": "项目页用section/article" },
    { "from": "n11", "to": "n16", "strength": "strong", "note": "联系页布局" },
    { "from": "n12", "to": "n14", "strength": "weak", "note": "可读性影响项目质量" },
    { "from": "n13", "to": "n16", "strength": "strong", "note": "多页面整合是项目的前置" },
    { "from": "n14", "to": "n16", "strength": "weak", "note": "首页完成后做联系页" },
    { "from": "n15", "to": "n16", "strength": "weak", "note": "展示页完成后做联系页" },
    { "from": "n16", "to": "n17", "strength": "strong", "note": "全部完成后部署" },
    { "from": "n5", "to": "n4", "strength": "parallel", "note": "图片可链接(a+img)" },
    { "from": "n6", "to": "n7", "strength": "parallel", "note": "列表和表格结构认知可并行" }
  ],
  "topological_order": [
    ["n1", "n11"],
    ["n2", "n3", "n5", "n6", "n8"],
    ["n4", "n7", "n9", "n12"],
    ["n10", "n13", "n14", "n15"],
    ["n16"],
    ["n17"]
  ],
  "pruned_branches": [
    { "node": "canvas/svg/iframe 等多媒体标签", "reason": "从终点能力(作品集网站纯HTML)不可达,v2多媒体专题覆盖" },
    { "node": "HTML 全局属性(class/id/data-*)", "reason": "class/id 属于 CSS/JS 联动范畴,本次纯 HTML 不可达,留作 v2 衔接" },
    { "node": "SEO meta 标签进阶(Open Graph/结构化数据)", "reason": "作品集项目无需 SEO,从终点能力不可达" }
  ],
  "lesson_plan": [
    {
      "day": 1,
      "nodes": ["n1", "n2"],
      "daily_goal": "写出第一个可渲染的 HTML 文档",
      "estimated_hours": 2
    },
    {
      "day": 2,
      "nodes": ["n3"],
      "daily_goal": "用 h1-h6/p/br/hr 写出带层级的文章内容",
      "estimated_hours": 1.5
    },
    {
      "day": 3,
      "nodes": ["n4", "n5", "n6"],
      "daily_goal": "插入链接和图片,用列表组织内容",
      "estimated_hours": 2
    },
    {
      "day": 4,
      "nodes": ["n7"],
      "daily_goal": "用 table/tr/td/th 制作项目数据表",
      "estimated_hours": 2
    },
    {
      "day": 5,
      "nodes": ["n8", "n9"],
      "daily_goal": "用 form + input 类型 + select + textarea 收集用户输入",
      "estimated_hours": 2
    },
    {
      "day": 6,
      "nodes": ["n10", "n11"],
      "daily_goal": "用 button/label 完成表单提交;用 header/nav/main/footer 语义化布局",
      "estimated_hours": 2
    },
    {
      "day": 7,
      "nodes": ["n12", "n13"],
      "daily_goal": "代码缩进与注释规范;用 a 标签把多个 .html 页面链接成站点",
      "estimated_hours": 2
    },
    {
      "day": 8,
      "nodes": ["n14"],
      "daily_goal": "独立搭建首页:语义化结构 + Hero 区 + 导航",
      "estimated_hours": 2
    },
    {
      "day": 9,
      "nodes": ["n15"],
      "daily_goal": "搭建项目展示页:用 ul/li + img 做卡片列表",
      "estimated_hours": 2
    },
    {
      "day": 10,
      "nodes": ["n16", "n17"],
      "daily_goal": "搭建联系表单页 + 全站导航整合 + 部署到 GitHub Pages",
      "estimated_hours": 2.5,
      "parallelism_broken": true
    }
  ]
}
